2025-11-12 19:00:01,840 - __main__ - INFO - Starting JavDB spider...
2025-11-12 19:00:01,840 - __main__ - INFO - Arguments: start_page=1, end_page=20, phase=all
2025-11-12 19:00:01,840 - __main__ - INFO - Validating history file integrity...
2025-11-12 19:00:01,878 - utils.history_manager - INFO - Loaded 4394 previously parsed movies from history (phase 1: 2640, phase 2: 1754)
2025-11-12 19:00:01,878 - __main__ - INFO - ==================================================
2025-11-12 19:00:01,878 - __main__ - INFO - PHASE 1: Processing entries with both subtitle and today/yesterday tags
2025-11-12 19:00:01,878 - __main__ - INFO - ==================================================
2025-11-12 19:00:03,325 - utils.parser - INFO - [Page 1] Found 4 entries for phase 1
2025-11-12 19:00:05,830 - utils.parser - INFO - [Page 2] Found 9 entries for phase 1
2025-11-12 19:00:08,328 - utils.parser - INFO - [Page 3] Found 10 entries for phase 1
2025-11-12 19:00:10,808 - utils.parser - INFO - [Page 4] Found 0 entries for phase 1
2025-11-12 19:00:13,345 - utils.parser - INFO - [Page 5] Found 0 entries for phase 1
2025-11-12 19:00:15,886 - utils.parser - INFO - [Page 6] Found 0 entries for phase 1
2025-11-12 19:00:18,390 - utils.parser - INFO - [Page 7] Found 0 entries for phase 1
2025-11-12 19:00:20,932 - utils.parser - INFO - [Page 8] Found 0 entries for phase 1
2025-11-12 19:00:23,468 - utils.parser - INFO - [Page 9] Found 0 entries for phase 1
2025-11-12 19:00:25,815 - utils.parser - INFO - [Page 10] Found 0 entries for phase 1
2025-11-12 19:00:28,354 - utils.parser - INFO - [Page 11] Found 0 entries for phase 1
2025-11-12 19:00:30,870 - utils.parser - INFO - [Page 12] Found 0 entries for phase 1
2025-11-12 19:00:33,389 - utils.parser - INFO - [Page 13] Found 0 entries for phase 1
2025-11-12 19:00:35,907 - utils.parser - INFO - [Page 14] Found 0 entries for phase 1
2025-11-12 19:00:38,656 - utils.parser - INFO - [Page 15] Found 0 entries for phase 1
2025-11-12 19:00:41,187 - utils.parser - INFO - [Page 16] Found 0 entries for phase 1
2025-11-12 19:00:43,716 - utils.parser - INFO - [Page 17] Found 0 entries for phase 1
2025-11-12 19:00:46,250 - utils.parser - INFO - [Page 18] Found 0 entries for phase 1
2025-11-12 19:00:48,785 - utils.parser - INFO - [Page 19] Found 0 entries for phase 1
2025-11-12 19:00:51,302 - utils.parser - INFO - [Page 20] Found 0 entries for phase 1
2025-11-12 19:00:56,784 - __main__ - INFO - [1/23] [Page 1] Processing ABF-276
2025-11-12 19:01:03,267 - __main__ - INFO - [2/23] [Page 1] Processing ADN-733
2025-11-12 19:01:09,758 - __main__ - INFO - [3/23] [Page 1] Processing ALDN-519
2025-11-12 19:01:16,234 - __main__ - INFO - [4/23] [Page 1] Processing DASS-735
2025-11-12 19:01:22,690 - __main__ - INFO - [5/23] [Page 2] Processing DASS-769
2025-11-12 19:01:29,151 - __main__ - INFO - [6/23] [Page 2] Processing DASS-805
2025-11-12 19:01:35,640 - __main__ - INFO - [7/23] [Page 2] Processing IPZZ-698
2025-11-12 19:01:42,104 - __main__ - INFO - [8/23] [Page 2] Processing JUR-053
2025-11-12 19:01:48,448 - __main__ - INFO - [9/23] [Page 2] Processing JUR-056
2025-11-12 19:01:54,928 - __main__ - INFO - [10/23] [Page 2] Processing JUR-511
2025-11-12 19:02:01,578 - __main__ - INFO - [11/23] [Page 2] Processing JUR-521
2025-11-12 19:02:08,097 - __main__ - INFO - [12/23] [Page 2] Processing STARS-734
2025-11-12 19:02:14,581 - __main__ - INFO - [13/23] [Page 2] Processing STARS-766
2025-11-12 19:02:21,089 - __main__ - INFO - [14/23] [Page 3] Processing CKCK-014
2025-11-12 19:02:26,518 - __main__ - INFO - [15/23] [Page 3] Processing CKCK-022
2025-11-12 19:02:31,958 - __main__ - INFO - [16/23] [Page 3] Processing CKCK-024
2025-11-12 19:02:37,400 - __main__ - INFO - [17/23] [Page 3] Processing CLUB-886
2025-11-12 19:02:42,843 - __main__ - INFO - [18/23] [Page 3] Processing CLUB-888
2025-11-12 19:02:48,290 - __main__ - INFO - [19/23] [Page 3] Processing DLDSS-436
2025-11-12 19:02:53,717 - __main__ - INFO - [20/23] [Page 3] Processing DLDSS-438
2025-11-12 19:02:59,177 - __main__ - INFO - [21/23] [Page 3] Processing DLDSS-440
2025-11-12 19:03:04,623 - __main__ - INFO - [22/23] [Page 3] Processing DLDSS-442
2025-11-12 19:03:10,134 - __main__ - INFO - [23/23] [Page 3] Processing START-306
2025-11-12 19:03:10,134 - __main__ - INFO - Phase 1 completed: 13 entries processed
2025-11-12 19:03:10,134 - __main__ - INFO - ==================================================
2025-11-12 19:03:10,134 - __main__ - INFO - PHASE 2: Processing entries with only today/yesterday tag (rate > 4.0, comments > 85)
2025-11-12 19:03:10,134 - __main__ - INFO - ==================================================
2025-11-12 19:03:10,634 - utils.parser - INFO - [Page 1] Found 5 entries for phase 2
2025-11-12 19:03:13,124 - utils.parser - INFO - [Page 2] Found 0 entries for phase 2
2025-11-12 19:03:15,634 - utils.parser - INFO - [Page 3] Found 6 entries for phase 2
2025-11-12 19:03:18,158 - utils.parser - INFO - [Page 4] Found 1 entries for phase 2
2025-11-12 19:03:20,662 - utils.parser - INFO - [Page 5] Found 0 entries for phase 2
2025-11-12 19:03:23,188 - utils.parser - INFO - [Page 6] Found 0 entries for phase 2
2025-11-12 19:03:25,756 - utils.parser - INFO - [Page 7] Found 0 entries for phase 2
2025-11-12 19:03:28,313 - utils.parser - INFO - [Page 8] Found 0 entries for phase 2
2025-11-12 19:03:30,877 - utils.parser - INFO - [Page 9] Found 0 entries for phase 2
2025-11-12 19:03:33,383 - utils.parser - INFO - [Page 10] Found 0 entries for phase 2
2025-11-12 19:03:35,890 - utils.parser - INFO - [Page 11] Found 0 entries for phase 2
2025-11-12 19:03:38,419 - utils.parser - INFO - [Page 12] Found 0 entries for phase 2
2025-11-12 19:03:40,938 - utils.parser - INFO - [Page 13] Found 0 entries for phase 2
2025-11-12 19:03:43,481 - utils.parser - INFO - [Page 14] Found 0 entries for phase 2
2025-11-12 19:03:46,029 - utils.parser - INFO - [Page 15] Found 0 entries for phase 2
2025-11-12 19:03:48,551 - utils.parser - INFO - [Page 16] Found 0 entries for phase 2
2025-11-12 19:03:51,110 - utils.parser - INFO - [Page 17] Found 0 entries for phase 2
2025-11-12 19:03:53,668 - utils.parser - INFO - [Page 18] Found 0 entries for phase 2
2025-11-12 19:03:56,181 - utils.parser - INFO - [Page 19] Found 0 entries for phase 2
2025-11-12 19:03:58,727 - utils.parser - INFO - [Page 20] Found 0 entries for phase 2
2025-11-12 19:04:04,270 - __main__ - INFO - [1/12] [Page 1] Processing JUR-528
2025-11-12 19:04:09,700 - __main__ - INFO - [2/12] [Page 1] Processing DASS-806
2025-11-12 19:04:15,135 - __main__ - INFO - [3/12] [Page 1] Processing START-443
2025-11-12 19:04:21,586 - __main__ - INFO - [4/12] [Page 1] Processing SWEET-042
2025-11-12 19:04:28,040 - __main__ - INFO - [5/12] [Page 1] Processing SWEET-043
2025-11-12 19:04:34,500 - __main__ - INFO - [6/12] [Page 3] Processing GVH-795
2025-11-12 19:04:39,955 - __main__ - INFO - [7/12] [Page 3] Processing CLOT-035
2025-11-12 19:04:45,405 - __main__ - INFO - [8/12] [Page 3] Processing URKK-119
2025-11-12 19:04:51,853 - __main__ - INFO - [9/12] [Page 3] Processing ABF-283
2025-11-12 19:04:57,286 - __main__ - INFO - [10/12] [Page 3] Processing KBR-032
2025-11-12 19:05:02,743 - __main__ - INFO - [11/12] [Page 3] Processing START-255
2025-11-12 19:05:08,190 - __main__ - INFO - [12/12] [Page 4] Processing AVSA-407
2025-11-12 19:05:08,190 - __main__ - INFO - Phase 2 completed: 4 entries processed
2025-11-12 19:05:08,190 - __main__ - INFO - CSV file written incrementally to: Daily Report/Javdb_TodayTitle_20251112.csv
2025-11-12 19:05:08,190 - __main__ - INFO - ==================================================
2025-11-12 19:05:08,190 - __main__ - INFO - SUMMARY REPORT
2025-11-12 19:05:08,190 - __main__ - INFO - ==================================================
2025-11-12 19:05:08,190 - __main__ - INFO - Pages processed: 1 to 20
2025-11-12 19:05:08,190 - __main__ - INFO - Tolerance mechanism: Stops after 3 consecutive pages with no HTML content
2025-11-12 19:05:08,190 - __main__ - INFO - ==============================
2025-11-12 19:05:08,190 - __main__ - INFO - PHASE 1 SUMMARY
2025-11-12 19:05:08,190 - __main__ - INFO - ==============================
2025-11-12 19:05:08,190 - __main__ - INFO - Phase 1 entries found: 13
2025-11-12 19:05:08,190 - __main__ - INFO -   - Subtitle torrents: 13 (100.0%)
2025-11-12 19:05:08,190 - __main__ - INFO -   - Hacked subtitle torrents: 6 (46.2%)
2025-11-12 19:05:08,190 - __main__ - INFO -   - Hacked no-subtitle torrents: 0 (0.0%)
2025-11-12 19:05:08,190 - __main__ - INFO -   - No-subtitle torrents: 0 (0.0%)
2025-11-12 19:05:08,190 - __main__ - INFO - ==============================
2025-11-12 19:05:08,190 - __main__ - INFO - PHASE 2 SUMMARY
2025-11-12 19:05:08,190 - __main__ - INFO - ==============================
2025-11-12 19:05:08,190 - __main__ - INFO - Phase 2 entries found: 4
2025-11-12 19:05:08,190 - __main__ - INFO -   - Subtitle torrents: 0 (0.0%)
2025-11-12 19:05:08,190 - __main__ - INFO -   - Hacked subtitle torrents: 0 (0.0%)
2025-11-12 19:05:08,190 - __main__ - INFO -   - Hacked no-subtitle torrents: 0 (0.0%)
2025-11-12 19:05:08,190 - __main__ - INFO -   - No-subtitle torrents: 4 (100.0%)
2025-11-12 19:05:08,190 - __main__ - INFO - ==============================
2025-11-12 19:05:08,190 - __main__ - INFO - OVERALL SUMMARY
2025-11-12 19:05:08,190 - __main__ - INFO - ==============================
2025-11-12 19:05:08,190 - __main__ - INFO - Total entries found: 17
2025-11-12 19:05:08,190 - __main__ - INFO - Successfully processed: 17
2025-11-12 19:05:08,190 - __main__ - INFO - Skipped already parsed in this session: 35
2025-11-12 19:05:08,190 - __main__ - INFO - Skipped already parsed in previous runs: 2640
2025-11-12 19:05:08,190 - __main__ - INFO - Current parsed links in memory: 35
2025-11-12 19:05:08,190 - __main__ - INFO - Overall subtitle torrents: 13 (76.5%)
2025-11-12 19:05:08,190 - __main__ - INFO - Overall hacked subtitle torrents: 6 (35.3%)
2025-11-12 19:05:08,190 - __main__ - INFO - Overall hacked no-subtitle torrents: 0 (0.0%)
2025-11-12 19:05:08,190 - __main__ - INFO - Overall no-subtitle torrents: 4 (23.5%)
2025-11-12 19:05:08,190 - __main__ - INFO - Results saved to: Daily Report/Javdb_TodayTitle_20251112.csv
2025-11-12 19:05:08,190 - __main__ - INFO - History saved to: Daily Report/parsed_movies_history.csv
2025-11-12 19:05:08,190 - __main__ - INFO - ==================================================
