2025-11-13 19:00:01,806 - __main__ - INFO - Starting JavDB spider...
2025-11-13 19:00:01,806 - __main__ - INFO - Arguments: start_page=1, end_page=20, phase=all
2025-11-13 19:00:01,806 - __main__ - INFO - Validating history file integrity...
2025-11-13 19:00:01,834 - utils.history_manager - INFO - Loaded 4406 previously parsed movies from history (phase 1: 2651, phase 2: 1755)
2025-11-13 19:00:01,834 - __main__ - INFO - ==================================================
2025-11-13 19:00:01,834 - __main__ - INFO - PHASE 1: Processing entries with both subtitle and today/yesterday tags
2025-11-13 19:00:01,834 - __main__ - INFO - ==================================================
2025-11-13 19:00:03,464 - utils.parser - INFO - [Page 1] Found 14 entries for phase 1
2025-11-13 19:00:05,972 - utils.parser - INFO - [Page 2] Found 3 entries for phase 1
2025-11-13 19:00:08,455 - utils.parser - INFO - [Page 3] Found 9 entries for phase 1
2025-11-13 19:00:10,947 - utils.parser - INFO - [Page 4] Found 0 entries for phase 1
2025-11-13 19:00:13,687 - utils.parser - INFO - [Page 5] Found 0 entries for phase 1
2025-11-13 19:00:16,202 - utils.parser - INFO - [Page 6] Found 0 entries for phase 1
2025-11-13 19:00:18,744 - utils.parser - INFO - [Page 7] Found 0 entries for phase 1
2025-11-13 19:00:21,224 - utils.parser - INFO - [Page 8] Found 0 entries for phase 1
2025-11-13 19:00:23,784 - utils.parser - INFO - [Page 9] Found 0 entries for phase 1
2025-11-13 19:00:26,295 - utils.parser - INFO - [Page 10] Found 0 entries for phase 1
2025-11-13 19:00:28,818 - utils.parser - INFO - [Page 11] Found 0 entries for phase 1
2025-11-13 19:00:31,351 - utils.parser - INFO - [Page 12] Found 0 entries for phase 1
2025-11-13 19:00:33,890 - utils.parser - INFO - [Page 13] Found 0 entries for phase 1
2025-11-13 19:00:36,428 - utils.parser - INFO - [Page 14] Found 0 entries for phase 1
2025-11-13 19:00:38,963 - utils.parser - INFO - [Page 15] Found 0 entries for phase 1
2025-11-13 19:00:41,471 - utils.parser - INFO - [Page 16] Found 0 entries for phase 1
2025-11-13 19:00:43,982 - utils.parser - INFO - [Page 17] Found 0 entries for phase 1
2025-11-13 19:00:46,596 - utils.parser - INFO - [Page 18] Found 0 entries for phase 1
2025-11-13 19:00:49,146 - utils.parser - INFO - [Page 19] Found 0 entries for phase 1
2025-11-13 19:00:51,668 - utils.parser - INFO - [Page 20] Found 0 entries for phase 1
2025-11-13 19:00:57,111 - __main__ - INFO - [1/26] [Page 1] Processing FOCS-282
2025-11-13 19:01:03,563 - __main__ - INFO - [2/26] [Page 1] Processing IPZZ-687
2025-11-13 19:01:10,041 - __main__ - INFO - [3/26] [Page 1] Processing IPZZ-697
2025-11-13 19:01:16,501 - __main__ - INFO - [4/26] [Page 1] Processing IPZZ-704
2025-11-13 19:01:22,945 - __main__ - INFO - [5/26] [Page 1] Processing IPZZ-708
2025-11-13 19:01:29,429 - __main__ - INFO - [6/26] [Page 1] Processing IPZZ-709
2025-11-13 19:01:35,922 - __main__ - INFO - [7/26] [Page 1] Processing IPZZ-710
2025-11-13 19:01:42,393 - __main__ - INFO - [8/26] [Page 1] Processing IPZZ-725
2025-11-13 19:01:48,862 - __main__ - INFO - [9/26] [Page 1] Processing IPZZ-738
2025-11-13 19:01:55,334 - __main__ - INFO - [10/26] [Page 1] Processing STARS-725
2025-11-13 19:02:01,783 - __main__ - INFO - [11/26] [Page 1] Processing STARS-766
2025-11-13 19:02:07,209 - __main__ - INFO - [12/26] [Page 1] Processing STARS-778
2025-11-13 19:02:13,707 - __main__ - INFO - [13/26] [Page 1] Processing STARS-804
2025-11-13 19:02:20,169 - __main__ - INFO - [14/26] [Page 1] Processing STARS-818
2025-11-13 19:02:26,606 - __main__ - INFO - [15/26] [Page 2] Processing ABF-276
2025-11-13 19:02:32,021 - __main__ - INFO - [16/26] [Page 2] Processing ADN-733
2025-11-13 19:02:37,574 - __main__ - INFO - [17/26] [Page 2] Processing ALDN-519
2025-11-13 19:02:43,025 - __main__ - INFO - [18/26] [Page 3] Processing DASS-735
2025-11-13 19:02:48,491 - __main__ - INFO - [19/26] [Page 3] Processing DASS-769
2025-11-13 19:02:53,911 - __main__ - INFO - [20/26] [Page 3] Processing DASS-805
2025-11-13 19:02:59,378 - __main__ - INFO - [21/26] [Page 3] Processing IPZZ-698
2025-11-13 19:03:04,840 - __main__ - INFO - [22/26] [Page 3] Processing JUR-053
2025-11-13 19:03:10,265 - __main__ - INFO - [23/26] [Page 3] Processing JUR-056
2025-11-13 19:03:15,711 - __main__ - INFO - [24/26] [Page 3] Processing JUR-511
2025-11-13 19:03:21,139 - __main__ - INFO - [25/26] [Page 3] Processing JUR-521
2025-11-13 19:03:26,590 - __main__ - INFO - [26/26] [Page 3] Processing STARS-734
2025-11-13 19:03:26,590 - __main__ - INFO - Phase 1 completed: 13 entries processed
2025-11-13 19:03:26,590 - __main__ - INFO - ==================================================
2025-11-13 19:03:26,590 - __main__ - INFO - PHASE 2: Processing entries with only today/yesterday tag (rate > 4.0, comments > 85)
2025-11-13 19:03:26,590 - __main__ - INFO - ==================================================
2025-11-13 19:03:27,101 - utils.parser - INFO - [Page 1] Found 0 entries for phase 2
2025-11-13 19:03:29,622 - utils.parser - INFO - [Page 2] Found 6 entries for phase 2
2025-11-13 19:03:32,145 - utils.parser - INFO - [Page 3] Found 3 entries for phase 2
2025-11-13 19:03:34,641 - utils.parser - INFO - [Page 4] Found 0 entries for phase 2
2025-11-13 19:03:37,189 - utils.parser - INFO - [Page 5] Found 0 entries for phase 2
2025-11-13 19:03:39,552 - utils.parser - INFO - [Page 6] Found 0 entries for phase 2
2025-11-13 19:03:41,879 - utils.parser - INFO - [Page 7] Found 0 entries for phase 2
2025-11-13 19:03:44,431 - utils.parser - INFO - [Page 8] Found 0 entries for phase 2
2025-11-13 19:03:46,965 - utils.parser - INFO - [Page 9] Found 0 entries for phase 2
2025-11-13 19:03:49,515 - utils.parser - INFO - [Page 10] Found 0 entries for phase 2
2025-11-13 19:03:51,850 - utils.parser - INFO - [Page 11] Found 0 entries for phase 2
2025-11-13 19:03:54,508 - utils.parser - INFO - [Page 12] Found 0 entries for phase 2
2025-11-13 19:03:57,165 - utils.parser - INFO - [Page 13] Found 0 entries for phase 2
2025-11-13 19:03:59,688 - utils.parser - INFO - [Page 14] Found 0 entries for phase 2
2025-11-13 19:04:02,184 - utils.parser - INFO - [Page 15] Found 0 entries for phase 2
2025-11-13 19:04:04,725 - utils.parser - INFO - [Page 16] Found 0 entries for phase 2
2025-11-13 19:04:07,239 - utils.parser - INFO - [Page 17] Found 0 entries for phase 2
2025-11-13 19:04:09,835 - utils.parser - INFO - [Page 18] Found 0 entries for phase 2
2025-11-13 19:04:12,368 - utils.parser - INFO - [Page 19] Found 0 entries for phase 2
2025-11-13 19:04:14,871 - utils.parser - INFO - [Page 20] Found 0 entries for phase 2
2025-11-13 19:04:20,320 - __main__ - INFO - [1/9] [Page 2] Processing JUR-528
2025-11-13 19:04:25,785 - __main__ - INFO - [2/9] [Page 2] Processing DASS-806
2025-11-13 19:04:31,254 - __main__ - INFO - [3/9] [Page 2] Processing SDJS-339
2025-11-13 19:04:37,896 - __main__ - INFO - [4/9] [Page 2] Processing START-443
2025-11-13 19:04:43,337 - __main__ - INFO - [5/9] [Page 2] Processing SWEET-042
2025-11-13 19:04:48,813 - __main__ - INFO - [6/9] [Page 2] Processing SWEET-043
2025-11-13 19:04:54,280 - __main__ - INFO - [7/9] [Page 3] Processing CEMD-765
2025-11-13 19:05:00,737 - __main__ - INFO - [8/9] [Page 3] Processing HEZ-840
2025-11-13 19:05:07,194 - __main__ - INFO - [9/9] [Page 3] Processing GVH-795
2025-11-13 19:05:07,194 - __main__ - INFO - Phase 2 completed: 3 entries processed
2025-11-13 19:05:07,194 - __main__ - INFO - CSV file written incrementally to: Daily Report/Javdb_TodayTitle_20251113.csv
2025-11-13 19:05:07,194 - __main__ - INFO - ==================================================
2025-11-13 19:05:07,194 - __main__ - INFO - SUMMARY REPORT
2025-11-13 19:05:07,194 - __main__ - INFO - ==================================================
2025-11-13 19:05:07,194 - __main__ - INFO - Pages processed: 1 to 20
2025-11-13 19:05:07,194 - __main__ - INFO - Tolerance mechanism: Stops after 3 consecutive pages with no HTML content
2025-11-13 19:05:07,194 - __main__ - INFO - ==============================
2025-11-13 19:05:07,194 - __main__ - INFO - PHASE 1 SUMMARY
2025-11-13 19:05:07,194 - __main__ - INFO - ==============================
2025-11-13 19:05:07,194 - __main__ - INFO - Phase 1 entries found: 13
2025-11-13 19:05:07,194 - __main__ - INFO -   - Subtitle torrents: 13 (100.0%)
2025-11-13 19:05:07,194 - __main__ - INFO -   - Hacked subtitle torrents: 4 (30.8%)
2025-11-13 19:05:07,194 - __main__ - INFO -   - Hacked no-subtitle torrents: 1 (7.7%)
2025-11-13 19:05:07,195 - __main__ - INFO -   - No-subtitle torrents: 0 (0.0%)
2025-11-13 19:05:07,195 - __main__ - INFO - ==============================
2025-11-13 19:05:07,195 - __main__ - INFO - PHASE 2 SUMMARY
2025-11-13 19:05:07,195 - __main__ - INFO - ==============================
2025-11-13 19:05:07,195 - __main__ - INFO - Phase 2 entries found: 3
2025-11-13 19:05:07,195 - __main__ - INFO -   - Subtitle torrents: 0 (0.0%)
2025-11-13 19:05:07,195 - __main__ - INFO -   - Hacked subtitle torrents: 0 (0.0%)
2025-11-13 19:05:07,195 - __main__ - INFO -   - Hacked no-subtitle torrents: 0 (0.0%)
2025-11-13 19:05:07,195 - __main__ - INFO -   - No-subtitle torrents: 3 (100.0%)
2025-11-13 19:05:07,195 - __main__ - INFO - ==============================
2025-11-13 19:05:07,195 - __main__ - INFO - OVERALL SUMMARY
2025-11-13 19:05:07,195 - __main__ - INFO - ==============================
2025-11-13 19:05:07,195 - __main__ - INFO - Total entries found: 16
2025-11-13 19:05:07,195 - __main__ - INFO - Successfully processed: 16
2025-11-13 19:05:07,195 - __main__ - INFO - Skipped already parsed in this session: 35
2025-11-13 19:05:07,195 - __main__ - INFO - Skipped already parsed in previous runs: 2651
2025-11-13 19:05:07,195 - __main__ - INFO - Current parsed links in memory: 35
2025-11-13 19:05:07,195 - __main__ - INFO - Overall subtitle torrents: 13 (81.2%)
2025-11-13 19:05:07,195 - __main__ - INFO - Overall hacked subtitle torrents: 4 (25.0%)
2025-11-13 19:05:07,195 - __main__ - INFO - Overall hacked no-subtitle torrents: 1 (6.2%)
2025-11-13 19:05:07,195 - __main__ - INFO - Overall no-subtitle torrents: 3 (18.8%)
2025-11-13 19:05:07,195 - __main__ - INFO - Results saved to: Daily Report/Javdb_TodayTitle_20251113.csv
2025-11-13 19:05:07,195 - __main__ - INFO - History saved to: Daily Report/parsed_movies_history.csv
2025-11-13 19:05:07,195 - __main__ - INFO - ==================================================
