2025-11-07 11:15:36,092 - __main__ - INFO - Starting JavDB spider...
2025-11-07 11:15:36,092 - __main__ - INFO - Arguments: start_page=1, end_page=20, phase=all
2025-11-07 11:15:36,092 - __main__ - INFO - Validating history file integrity...
2025-11-07 11:15:36,128 - utils.history_manager - INFO - Loaded 4291 previously parsed movies from history (phase : 3, phase 1: 2578, phase 2: 1710)
2025-11-07 11:15:36,129 - __main__ - INFO - ==================================================
2025-11-07 11:15:36,129 - __main__ - INFO - PHASE 1: Processing entries with both subtitle and today/yesterday tags
2025-11-07 11:15:36,129 - __main__ - INFO - ==================================================
2025-11-07 11:15:38,126 - utils.parser - INFO - [Page 1] Found 11 entries for phase 1
2025-11-07 11:15:40,700 - utils.parser - INFO - [Page 2] Found 0 entries for phase 1
2025-11-07 11:15:43,276 - utils.parser - INFO - [Page 3] Found 0 entries for phase 1
2025-11-07 11:15:45,838 - utils.parser - INFO - [Page 4] Found 11 entries for phase 1
2025-11-07 11:15:48,391 - utils.parser - INFO - [Page 5] Found 0 entries for phase 1
2025-11-07 11:15:50,955 - utils.parser - INFO - [Page 6] Found 0 entries for phase 1
2025-11-07 11:15:53,518 - utils.parser - INFO - [Page 7] Found 0 entries for phase 1
2025-11-07 11:15:56,087 - utils.parser - INFO - [Page 8] Found 0 entries for phase 1
2025-11-07 11:15:58,648 - utils.parser - INFO - [Page 9] Found 0 entries for phase 1
2025-11-07 11:16:01,223 - utils.parser - INFO - [Page 10] Found 0 entries for phase 1
2025-11-07 11:16:03,790 - utils.parser - INFO - [Page 11] Found 0 entries for phase 1
2025-11-07 11:16:06,350 - utils.parser - INFO - [Page 12] Found 0 entries for phase 1
2025-11-07 11:16:08,920 - utils.parser - INFO - [Page 13] Found 0 entries for phase 1
2025-11-07 11:16:11,480 - utils.parser - INFO - [Page 14] Found 0 entries for phase 1
2025-11-07 11:16:14,045 - utils.parser - INFO - [Page 15] Found 0 entries for phase 1
2025-11-07 11:16:16,653 - utils.parser - INFO - [Page 16] Found 0 entries for phase 1
2025-11-07 11:16:19,240 - utils.parser - INFO - [Page 17] Found 0 entries for phase 1
2025-11-07 11:16:21,798 - utils.parser - INFO - [Page 18] Found 0 entries for phase 1
2025-11-07 11:16:24,370 - utils.parser - INFO - [Page 19] Found 0 entries for phase 1
2025-11-07 11:16:26,956 - utils.parser - INFO - [Page 20] Found 0 entries for phase 1
2025-11-07 11:16:32,334 - __main__ - INFO - [1/22] [Page 1] Processing ABF-272
2025-11-07 11:16:38,856 - __main__ - INFO - [2/22] [Page 1] Processing ADN-731
2025-11-07 11:16:45,398 - __main__ - INFO - [3/22] [Page 1] Processing ATID-631
2025-11-07 11:16:51,943 - __main__ - INFO - [4/22] [Page 1] Processing ATID-651
2025-11-07 11:16:58,455 - __main__ - INFO - [5/22] [Page 1] Processing JUR-473
2025-11-07 11:17:04,998 - __main__ - INFO - [6/22] [Page 1] Processing MIAB-548
2025-11-07 11:17:11,523 - __main__ - INFO - [7/22] [Page 1] Processing MIDA-343
2025-11-07 11:17:18,049 - __main__ - INFO - [8/22] [Page 1] Processing MIDA-389
2025-11-07 11:17:24,563 - __main__ - INFO - [9/22] [Page 1] Processing MIDA-391
2025-11-07 11:17:31,134 - __main__ - INFO - [10/22] [Page 1] Processing STARS-573
2025-11-07 11:17:37,652 - __main__ - INFO - [11/22] [Page 1] Processing STARS-678
2025-11-07 11:17:44,153 - __main__ - INFO - [12/22] [Page 4] Processing ABF-276
2025-11-07 11:17:50,702 - __main__ - INFO - [13/22] [Page 4] Processing ADN-702
2025-11-07 11:17:57,220 - __main__ - INFO - [14/22] [Page 4] Processing ADN-733
2025-11-07 11:18:03,741 - __main__ - INFO - [15/22] [Page 4] Processing MIDA-392
2025-11-07 11:18:10,244 - __main__ - INFO - [16/22] [Page 4] Processing MIDA-393
2025-11-07 11:18:16,796 - __main__ - INFO - [17/22] [Page 4] Processing MIDA-396
2025-11-07 11:18:23,327 - __main__ - INFO - [18/22] [Page 4] Processing MIDA-397
2025-11-07 11:18:29,852 - __main__ - INFO - [19/22] [Page 4] Processing MIDA-398
2025-11-07 11:18:36,378 - __main__ - INFO - [20/22] [Page 4] Processing MIFD-682
2025-11-07 11:18:42,925 - __main__ - INFO - [21/22] [Page 4] Processing SSIS-906
2025-11-07 11:18:49,642 - __main__ - INFO - [22/22] [Page 4] Processing START-281
2025-11-07 11:18:50,667 - __main__ - INFO - Phase 1 completed: 22 entries processed
2025-11-07 11:18:50,667 - __main__ - INFO - ==================================================
2025-11-07 11:18:50,667 - __main__ - INFO - PHASE 2: Processing entries with only today/yesterday tag (rate > 4.0, comments > 85)
2025-11-07 11:18:50,667 - __main__ - INFO - ==================================================
2025-11-07 11:18:51,251 - utils.parser - INFO - [Page 1] Found 4 entries for phase 2
2025-11-07 11:18:53,799 - utils.parser - INFO - [Page 2] Found 2 entries for phase 2
2025-11-07 11:18:56,357 - utils.parser - INFO - [Page 3] Found 2 entries for phase 2
2025-11-07 11:18:58,902 - utils.parser - INFO - [Page 4] Found 3 entries for phase 2
2025-11-07 11:19:01,472 - utils.parser - INFO - [Page 5] Found 0 entries for phase 2
2025-11-07 11:19:03,942 - utils.parser - INFO - [Page 6] Found 0 entries for phase 2
2025-11-07 11:19:06,738 - utils.parser - INFO - [Page 7] Found 0 entries for phase 2
2025-11-07 11:19:09,307 - utils.parser - INFO - [Page 8] Found 0 entries for phase 2
2025-11-07 11:19:11,882 - utils.parser - INFO - [Page 9] Found 0 entries for phase 2
2025-11-07 11:19:14,462 - utils.parser - INFO - [Page 10] Found 0 entries for phase 2
2025-11-07 11:19:17,045 - utils.parser - INFO - [Page 11] Found 0 entries for phase 2
2025-11-07 11:19:19,634 - utils.parser - INFO - [Page 12] Found 0 entries for phase 2
2025-11-07 11:19:22,213 - utils.parser - INFO - [Page 13] Found 0 entries for phase 2
2025-11-07 11:19:24,778 - utils.parser - INFO - [Page 14] Found 0 entries for phase 2
2025-11-07 11:19:27,372 - utils.parser - INFO - [Page 15] Found 0 entries for phase 2
2025-11-07 11:19:29,955 - utils.parser - INFO - [Page 16] Found 0 entries for phase 2
2025-11-07 11:19:32,527 - utils.parser - INFO - [Page 17] Found 0 entries for phase 2
2025-11-07 11:19:35,109 - utils.parser - INFO - [Page 18] Found 0 entries for phase 2
2025-11-07 11:19:37,685 - utils.parser - INFO - [Page 19] Found 0 entries for phase 2
2025-11-07 11:19:40,458 - utils.parser - INFO - [Page 20] Found 0 entries for phase 2
2025-11-07 11:19:46,009 - __main__ - INFO - [1/11] [Page 1] Processing ADN-738
2025-11-07 11:19:52,591 - __main__ - INFO - [2/11] [Page 1] Processing SAME-207
2025-11-07 11:19:59,516 - __main__ - INFO - [3/11] [Page 1] Processing ABF-284
2025-11-07 11:20:06,071 - __main__ - INFO - [4/11] [Page 1] Processing SONE-974
2025-11-07 11:20:12,589 - __main__ - INFO - [5/11] [Page 2] Processing JNT-110
2025-11-07 11:20:19,165 - __main__ - INFO - [6/11] [Page 2] Processing IPZZ-698
2025-11-07 11:20:25,674 - __main__ - INFO - [7/11] [Page 3] Processing GNI-007
2025-11-07 11:20:32,249 - __main__ - INFO - [8/11] [Page 3] Processing DMOW-224
2025-11-07 11:20:38,791 - __main__ - INFO - [9/11] [Page 4] Processing JUFE-535
2025-11-07 11:20:45,337 - __main__ - INFO - [10/11] [Page 4] Processing SAME-205
2025-11-07 11:20:51,895 - __main__ - INFO - [11/11] [Page 4] Processing WAAA-503
2025-11-07 11:20:52,922 - __main__ - INFO - Phase 2 completed: 11 entries processed
2025-11-07 11:20:52,923 - __main__ - INFO - CSV file written incrementally to: Daily Report/Javdb_TodayTitle_20251107.csv
2025-11-07 11:20:52,923 - __main__ - INFO - ==================================================
2025-11-07 11:20:52,923 - __main__ - INFO - SUMMARY REPORT
2025-11-07 11:20:52,923 - __main__ - INFO - ==================================================
2025-11-07 11:20:52,923 - __main__ - INFO - Pages processed: 1 to 20
2025-11-07 11:20:52,923 - __main__ - INFO - Tolerance mechanism: Stops after 3 consecutive pages with no HTML content
2025-11-07 11:20:52,923 - __main__ - INFO - ==============================
2025-11-07 11:20:52,923 - __main__ - INFO - PHASE 1 SUMMARY
2025-11-07 11:20:52,923 - __main__ - INFO - ==============================
2025-11-07 11:20:52,923 - __main__ - INFO - Phase 1 entries found: 22
2025-11-07 11:20:52,923 - __main__ - INFO -   - Subtitle torrents: 22 (100.0%)
2025-11-07 11:20:52,924 - __main__ - INFO -   - Hacked subtitle torrents: 7 (31.8%)
2025-11-07 11:20:52,924 - __main__ - INFO -   - Hacked no-subtitle torrents: 0 (0.0%)
2025-11-07 11:20:52,924 - __main__ - INFO -   - No-subtitle torrents: 0 (0.0%)
2025-11-07 11:20:52,925 - __main__ - INFO - ==============================
2025-11-07 11:20:52,925 - __main__ - INFO - PHASE 2 SUMMARY
2025-11-07 11:20:52,925 - __main__ - INFO - ==============================
2025-11-07 11:20:52,925 - __main__ - INFO - Phase 2 entries found: 11
2025-11-07 11:20:52,925 - __main__ - INFO -   - Subtitle torrents: 0 (0.0%)
2025-11-07 11:20:52,926 - __main__ - INFO -   - Hacked subtitle torrents: 5 (45.5%)
2025-11-07 11:20:52,926 - __main__ - INFO -   - Hacked no-subtitle torrents: 0 (0.0%)
2025-11-07 11:20:52,926 - __main__ - INFO -   - No-subtitle torrents: 11 (100.0%)
2025-11-07 11:20:52,926 - __main__ - INFO - ==============================
2025-11-07 11:20:52,926 - __main__ - INFO - OVERALL SUMMARY
2025-11-07 11:20:52,926 - __main__ - INFO - ==============================
2025-11-07 11:20:52,926 - __main__ - INFO - Total entries found: 33
2025-11-07 11:20:52,926 - __main__ - INFO - Successfully processed: 33
2025-11-07 11:20:52,926 - __main__ - INFO - Skipped already parsed in this session: 33
2025-11-07 11:20:52,926 - __main__ - INFO - Skipped already parsed in previous runs: 2581
2025-11-07 11:20:52,926 - __main__ - INFO - Current parsed links in memory: 33
2025-11-07 11:20:52,926 - __main__ - INFO - Overall subtitle torrents: 22 (66.7%)
2025-11-07 11:20:52,926 - __main__ - INFO - Overall hacked subtitle torrents: 12 (36.4%)
2025-11-07 11:20:52,926 - __main__ - INFO - Overall hacked no-subtitle torrents: 0 (0.0%)
2025-11-07 11:20:52,927 - __main__ - INFO - Overall no-subtitle torrents: 11 (33.3%)
2025-11-07 11:20:52,927 - __main__ - INFO - Results saved to: Daily Report/Javdb_TodayTitle_20251107.csv
2025-11-07 11:20:52,927 - __main__ - INFO - History saved to: Daily Report/parsed_movies_history.csv
2025-11-07 11:20:52,927 - __main__ - INFO - ==================================================
